{
  "schema_version": "zendesk_feature_report_v1",
  "meta": {
    "source": "zendesk",
    "generated_at": "2025-12-21",
    "feature_name": "daily wage calculator",
    "feature_slug": "daily_wage_calculator",
    "clean_feature_name": "daily_wage_calculator",
    "articles_received_count": 3,
    "article_ids": [
      "14154746403601",
      "14243704039185",
      "14243760419089"
    ],
    "doc_categories": {
      "feature_documentation": 2,
      "feature_introduction": 1
    },
    "recency_assessment": "fresh",
    "parse_status": "ok"
  },
  "feature": {
    "name": "daily wage calculator",
    "slug": "daily_wage_calculator",
    "description": "The daily wage calculator is a payroll system feature designed to precisely calculate salary deductions for unpaid leave by determining an employee's daily pay rate. It enables HR personnel to automatically process leave-related salary adjustments by dividing an employee's total salary (basic + allowance) by the number of actual working days in a month. The calculator accommodates different leave policies, supporting both calendar day (30 days) and working day (e.g., 22 days) calculations. It intelligently accounts for public holidays by subtracting them from the total working days, ensuring accurate and fair salary reductions. This systematic approach provides a transparent and consistent method for handling unpaid leave financial implications, reducing manual calculation errors and streamlining payroll processing. The daily wage calculator is an advanced payroll tool designed to provide flexible and precise methods for calculating employee compensation across various scenarios. It enables payroll managers to dynamically determine daily wage rates by selecting from multiple calculation bases including calendar days, working days, or custom days. The calculator addresses complex payroll challenges by allowing customization of salary component inclusions, such as basic salary, basic salary plus allowances, or allowances only. By supporting salary proration, leave encashment, and unpaid leave deductions, the tool offers unprecedented control over wage calculations. Organizations can align the calculator with their specific labor law requirements, particularly in regions like UAE and KSA where custom 30-day calculations are prevalent. The solution eliminates previous limitations in daily rate computations by providing granular configuration options that account for variations in monthly work periods, public holidays, and company-specific policies. The daily wage calculator is a payroll management tool designed to help organizations proportionally adjust employee salaries based on actual days worked. It enables super administrators to configure salary proration using multiple calculation methods, including custom days, calendar days, and working days. This feature is critical for accurately compensating employees during their first month of employment, during partial work periods, or when calculating end-of-service settlements. By providing flexible calculation bases, the tool ensures precise and fair salary adjustments that reflect an employee's actual work time. The calculator integrates directly with the payroll system, allowing administrators to make global changes that impact active (unpaid) payroll transactions. Its primary value lies in creating transparency and accuracy in compensation calculations, reducing manual errors and providing a standardized approach to prorating salaries across different employment scenarios."
  },
  "reference_article_ids": [
    "14154746403601",
    "14243704039185",
    "14243760419089"
  ],
  "source_articles_index": [
    {
      "article_id": 14154746403601,
      "title": "How is daily pay calculated",
      "article_url": "https://bayzathelp.zendesk.com/hc/en-gb/articles/14154746403601-How-is-daily-pay-calculated",
      "doc_category": "feature_documentation",
      "keywords": [
        "unpaid leave",
        "daily pay calculation",
        "salary deduction",
        "working days",
        "calendar days",
        "public holidays",
        "payroll"
      ],
      "article_summary": "Explains how daily pay is calculated for unpaid leave, including methods for determining working days and handling public holidays"
    },
    {
      "article_id": 14243704039185,
      "title": "Introduction to daily wage calculator",
      "article_url": "https://bayzathelp.zendesk.com/hc/en-gb/articles/14243704039185-Introduction-to-daily-wage-calculator",
      "doc_category": "feature_introduction",
      "keywords": [
        "daily wage",
        "salary proration",
        "leave encashment",
        "unpaid leave",
        "calculation base",
        "calendar days",
        "working days",
        "custom days",
        "payroll",
        "labor law"
      ],
      "article_summary": "Introduces a new Daily Wage calculator with flexible options for calculating daily rates, supporting salary proration, leave encashment, and unpaid leave deductions."
    },
    {
      "article_id": 14243760419089,
      "title": "Salary Proration",
      "article_url": "https://bayzathelp.zendesk.com/hc/en-gb/articles/14243760419089-Salary-Proration",
      "doc_category": "feature_documentation",
      "keywords": [
        "daily wage calculator",
        "payroll",
        "salary calculation",
        "prorated salary",
        "super admin",
        "calculation bases",
        "working days",
        "calendar days",
        "custom days"
      ],
      "article_summary": "Explains how to update salary proration, affecting employee's first salary and end-of-service settlement through the Daily Wage Calculator"
    }
  ],
  "documented_knowledge": {
    "job_to_be_done": [
      {
        "statement": "Calculate and deduct daily pay for employees taking unpaid leave by determining the appropriate salary reduction",
        "source_article_ids": [
          14154746403601
        ]
      },
      {
        "statement": "Provide a flexible and customizable method for calculating daily wages, including salary proration, leave encashment, and unpaid leave deductions",
        "source_article_ids": [
          14243704039185
        ]
      },
      {
        "statement": "Adjust and calculate an employee's salary proportionally based on the actual days worked",
        "source_article_ids": [
          14243760419089
        ]
      }
    ],
    "primary_personas": [
      {
        "persona": "HR personnel and payroll administrators",
        "source_article_ids": [
          14154746403601
        ]
      },
      {
        "persona": "Superadmin",
        "source_article_ids": [
          14243704039185
        ]
      },
      {
        "persona": "Payroll table managers",
        "source_article_ids": [
          14243704039185
        ]
      },
      {
        "persona": "Transaction processors",
        "source_article_ids": [
          14243704039185
        ]
      },
      {
        "persona": "Super admin",
        "source_article_ids": [
          14243760419089
        ]
      }
    ],
    "navigation_paths": [
      {
        "path": "Unpaid Leave Request → Approval → Payroll Deduction",
        "context": "Automated leave and salary management workflow",
        "source_article_ids": [
          14154746403601
        ]
      },
      {
        "path": "Settings → Payroll → Daily Wage Calculation",
        "context": "Accessing the Daily Wage Calculator",
        "source_article_ids": [
          14243704039185
        ]
      },
      {
        "path": "Settings > Payroll > Daily wage calculation",
        "context": "Accessing salary proration configuration",
        "source_article_ids": [
          14243760419089
        ]
      }
    ],
    "prerequisites": [
      {
        "requirement": "Approved unpaid leave request",
        "source_article_ids": [
          14154746403601
        ]
      },
      {
        "requirement": "Company's public holiday calendar must be configured",
        "source_article_ids": [
          14243704039185
        ]
      },
      {
        "requirement": "User must have super admin permissions",
        "source_article_ids": [
          14243760419089
        ]
      }
    ],
    "data_inputs_required": [
      {
        "input": "Employee's total salary (basic + allowance)",
        "details": "Includes basic salary and additional allowances",
        "source_article_ids": [
          14154746403601
        ]
      },
      {
        "input": "Number of working days in the month",
        "details": "Can be calendar days (30) or working days (e.g., 22)",
        "source_article_ids": [
          14154746403601
        ]
      },
      {
        "input": "Calculation base",
        "details": "Choose between calendar days, working days, or custom days",
        "source_article_ids": [
          14243704039185
        ]
      },
      {
        "input": "Salary components",
        "details": "Select basic salary, basic salary plus allowances, or allowances only",
        "source_article_ids": [
          14243704039185
        ]
      },
      {
        "input": "Calculation basis",
        "details": "Choose from custom days, calendar days, or working days",
        "source_article_ids": [
          14243760419089
        ]
      }
    ],
    "outputs_results": [
      {
        "output": "Automatic payroll deduction",
        "details": "Reflected on the payroll table based on calculated daily pay rate",
        "source_article_ids": [
          14154746403601
        ]
      },
      {
        "output": "Daily wage rates",
        "details": "Calculated for salary proration, leave encashment, and unpaid leave deduction",
        "source_article_ids": [
          14243704039185
        ]
      },
      {
        "output": "Prorated salary calculations",
        "details": "Proportionally adjusted employee compensation based on selected calculation method",
        "source_article_ids": [
          14243760419089
        ]
      }
    ],
    "procedures": [
      {
        "procedure_name": "Daily Pay Calculation",
        "when_to_use": "Processing unpaid leave salary deductions",
        "steps": [
          "Determine leave policy (calendar or working days)",
          "Calculate total working days",
          "Subtract public holidays",
          "Divide total salary by actual working days",
          "Generate payroll deduction"
        ],
        "source_article_ids": [
          14154746403601
        ]
      },
      {
        "procedure_name": "Daily Wage Calculation",
        "when_to_use": "For prorating salaries, calculating leave encashment, and determining unpaid leave deductions",
        "steps": [
          "Navigate to Settings",
          "Select Payroll",
          "Choose Daily Wage Calculation",
          "Select calculation type (calendar/working/custom days)",
          "Choose salary components to include",
          "Apply calculation"
        ],
        "source_article_ids": [
          14243704039185
        ]
      },
      {
        "procedure_name": "Update Salary Proration",
        "when_to_use": "Adjusting salary calculations for partial work periods",
        "steps": [
          "Go to Settings > Payroll > Daily wage calculation",
          "Select calculation basis (custom days, calendar days, working days)",
          "Save changes",
          "If payroll month is open, reject existing prorated salary transactions",
          "Confirm new proration settings"
        ],
        "source_article_ids": [
          14243760419089
        ]
      }
    ],
    "rules_limitations_constraints": [
      {
        "rule": "Daily pay = Salary Amount (Basic + Allowance) / Number of actual working days",
        "source_article_ids": [
          14154746403601
        ]
      },
      {
        "rule": "Can use calendar days (30 days) or working days (e.g., 22 days)",
        "source_article_ids": [
          14154746403601
        ]
      },
      {
        "rule": "Public holidays are subtracted from working days",
        "source_article_ids": [
          14154746403601
        ]
      },
      {
        "rule": "Calculation can be based on calendar days, working days, or custom days",
        "source_article_ids": [
          14243704039185
        ]
      },
      {
        "rule": "Can exclude weekends and public holidays",
        "source_article_ids": [
          14243704039185
        ]
      },
      {
        "rule": "Most UAE and KSA companies use 30 custom days to align with labor law",
        "source_article_ids": [
          14243704039185
        ]
      },
      {
        "rule": "Changes affect all active (unpaid) amounts in the payroll table",
        "source_article_ids": [
          14243760419089
        ]
      },
      {
        "rule": "When payroll month is open, must reject existing prorated salary transactions before saving new settings",
        "source_article_ids": [
          14243760419089
        ]
      }
    ],
    "edge_cases_warnings": [
      {
        "edge_case_or_warning": "Public holidays must be considered and subtracted from working days",
        "source_article_ids": [
          14154746403601
        ]
      },
      {
        "edge_case_or_warning": "Calculation varies depending on month length (e.g., 31 days in January, 28 days in February)",
        "source_article_ids": [
          14243704039185
        ]
      },
      {
        "edge_case_or_warning": "When payroll month is open and prorated salary transactions exist, super admin must manually reject and resave transactions",
        "source_article_ids": [
          14243760419089
        ]
      }
    ],
    "feature_interactions_dependencies": [
      {
        "interaction": "Interacts with payroll system to create and reflect pay deductions",
        "source_article_ids": [
          14154746403601
        ]
      },
      {
        "interaction": "Interacts with Payroll system and affects active payroll table transactions",
        "source_article_ids": [
          14243760419089
        ]
      }
    ],
    "glossary_terms": [
      {
        "term": "Daily Pay",
        "definition_from_docs": "Salary Amount (Basic + Allowance) divided by the number of actual working days in a month",
        "source_article_ids": [
          14154746403601
        ]
      },
      {
        "term": "Calendar days",
        "definition_from_docs": "The number of days in a given month",
        "source_article_ids": [
          14243704039185
        ]
      },
      {
        "term": "Working days",
        "definition_from_docs": "Only business days are counted, excluding weekends and public holidays",
        "source_article_ids": [
          14243704039185
        ]
      },
      {
        "term": "Custom days",
        "definition_from_docs": "Flexibility to set calculation base according to company policies",
        "source_article_ids": [
          14243704039185
        ]
      },
      {
        "term": "Salary Proration",
        "definition_from_docs": "Proportional salary adjustment based on actual days worked, affecting first salary and end-of-service settlement",
        "source_article_ids": [
          14243760419089
        ]
      }
    ]
  },
  "claims_to_validate": [
    {
      "claim_id": "daily_pay_calculation_rule",
      "claim_type": "calculation_rule",
      "claim_text": "Daily pay is calculated by dividing total salary by the number of actual working days",
      "validation_hint": "Verify calculation matches documented formula",
      "source_article_ids": [
        14154746403601
      ],
      "risk_of_being_outdated": "low"
    },
    {
      "claim_id": "public_holiday_deduction",
      "claim_type": "system_behavior",
      "claim_text": "Public holidays are automatically subtracted from total working days",
      "validation_hint": "Check if holiday days are correctly removed from working days calculation",
      "source_article_ids": [
        14154746403601
      ],
      "risk_of_being_outdated": "low"
    },
    {
      "claim_id": "nav_001",
      "claim_type": "navigation",
      "claim_text": "Daily Wage Calculator is accessible via Settings → Payroll → Daily Wage Calculation",
      "validation_hint": "Verify navigation path exists and leads to correct page",
      "source_article_ids": [
        14243704039185
      ],
      "risk_of_being_outdated": "low"
    },
    {
      "claim_id": "calc_base_001",
      "claim_type": "system_behavior",
      "claim_text": "User can select calculation base from calendar days, working days, or custom days",
      "validation_hint": "Verify all three calculation base options are available and selectable",
      "source_article_ids": [
        14243704039185
      ],
      "risk_of_being_outdated": "low"
    },
    {
      "claim_id": "salary_comp_001",
      "claim_type": "calculation_rule",
      "claim_text": "Salary components can be selected from basic salary, basic salary plus allowances, or allowances only",
      "validation_hint": "Verify all three salary component options are present in dropdown/selection",
      "source_article_ids": [
        14243704039185
      ],
      "risk_of_being_outdated": "low"
    },
    {
      "claim_id": "navigation_path_1",
      "claim_type": "navigation",
      "claim_text": "Super admin can navigate to Daily wage calculation via Settings > Payroll",
      "validation_hint": "Verify menu path exists and is accessible",
      "source_article_ids": [
        14243760419089
      ],
      "risk_of_being_outdated": "low"
    },
    {
      "claim_id": "calculation_basis_selection",
      "claim_type": "ui_step",
      "claim_text": "User can select from custom days, calendar days, or working days calculation basis",
      "validation_hint": "Verify all three calculation basis options are present and selectable",
      "source_article_ids": [
        14243760419089
      ],
      "risk_of_being_outdated": "low"
    },
    {
      "claim_id": "proration_save_behavior",
      "claim_type": "system_behavior",
      "claim_text": "Saving proration changes affects all active (unpaid) payroll amounts",
      "validation_hint": "Confirm that saved changes propagate to unpaid transactions",
      "source_article_ids": [
        14243760419089
      ],
      "risk_of_being_outdated": "medium"
    }
  ],
  "markdown_report": "# Zendesk Documentation – daily wage calculator\n\nGenerated on: 2025-12-21\n\n## Feature Overview (From Zendesk articles)\nThe daily wage calculator is a payroll system feature designed to precisely calculate salary deductions for unpaid leave by determining an employee's daily pay rate. It enables HR personnel to automatically process leave-related salary adjustments by dividing an employee's total salary (basic + allowance) by the number of actual working days in a month. The calculator accommodates different leave policies, supporting both calendar day (30 days) and working day (e.g., 22 days) calculations. It intelligently accounts for public holidays by subtracting them from the total working days, ensuring accurate and fair salary reductions. This systematic approach provides a transparent and consistent method for handling unpaid leave financial implications, reducing manual calculation errors and streamlining payroll processing. The daily wage calculator is an advanced payroll tool designed to provide flexible and precise methods for calculating employee compensation across various scenarios. It enables payroll managers to dynamically determine daily wage rates by selecting from multiple calculation bases including calendar days, working days, or custom days. The calculator addresses complex payroll challenges by allowing customization of salary component inclusions, such as basic salary, basic salary plus allowances, or allowances only. By supporting salary proration, leave encashment, and unpaid leave deductions, the tool offers unprecedented control over wage calculations. Organizations can align the calculator with their specific labor law requirements, particularly in regions like UAE and KSA where custom 30-day calculations are prevalent. The solution eliminates previous limitations in daily rate computations by providing granular configuration options that account for variations in monthly work periods, public holidays, and company-specific policies. The daily wage calculator is a payroll management tool designed to help organizations proportionally adjust employee salaries based on actual days worked. It enables super administrators to configure salary proration using multiple calculation methods, including custom days, calendar days, and working days. This feature is critical for accurately compensating employees during their first month of employment, during partial work periods, or when calculating end-of-service settlements. By providing flexible calculation bases, the tool ensures precise and fair salary adjustments that reflect an employee's actual work time. The calculator integrates directly with the payroll system, allowing administrators to make global changes that impact active (unpaid) payroll transactions. Its primary value lies in creating transparency and accuracy in compensation calculations, reducing manual errors and providing a standardized approach to prorating salaries across different employment scenarios.\n\n## Observed Jobs To Be Done\n- Calculate and deduct daily pay for employees taking unpaid leave by determining the appropriate salary reduction [Articles: 14154746403601]\n- Provide a flexible and customizable method for calculating daily wages, including salary proration, leave encashment, and unpaid leave deductions [Articles: 14243704039185]\n- Adjust and calculate an employee's salary proportionally based on the actual days worked [Articles: 14243760419089]\n\n## Primary Personas\n- HR personnel and payroll administrators [Articles: 14154746403601]\n- Superadmin [Articles: 14243704039185]\n- Payroll table managers [Articles: 14243704039185]\n- Transaction processors [Articles: 14243704039185]\n- Super admin [Articles: 14243760419089]\n\n## Navigation Paths\n- Unpaid Leave Request → Approval → Payroll Deduction | context: Automated leave and salary management workflow | [Articles: 14154746403601]\n- Settings → Payroll → Daily Wage Calculation | context: Accessing the Daily Wage Calculator | [Articles: 14243704039185]\n- Settings > Payroll > Daily wage calculation | context: Accessing salary proration configuration | [Articles: 14243760419089]\n\n## Prerequisites\n- Approved unpaid leave request [Articles: 14154746403601]\n- Company's public holiday calendar must be configured [Articles: 14243704039185]\n- User must have super admin permissions [Articles: 14243760419089]\n\n## Required Inputs\n- Employee's total salary (basic + allowance) | details: Includes basic salary and additional allowances | [Articles: 14154746403601]\n- Number of working days in the month | details: Can be calendar days (30) or working days (e.g., 22) | [Articles: 14154746403601]\n- Calculation base | details: Choose between calendar days, working days, or custom days | [Articles: 14243704039185]\n- Salary components | details: Select basic salary, basic salary plus allowances, or allowances only | [Articles: 14243704039185]\n- Calculation basis | details: Choose from custom days, calendar days, or working days | [Articles: 14243760419089]\n\n## Expected Outputs\n- Automatic payroll deduction | details: Reflected on the payroll table based on calculated daily pay rate | [Articles: 14154746403601]\n- Daily wage rates | details: Calculated for salary proration, leave encashment, and unpaid leave deduction | [Articles: 14243704039185]\n- Prorated salary calculations | details: Proportionally adjusted employee compensation based on selected calculation method | [Articles: 14243760419089]\n\n## Procedures\n- **Daily Pay Calculation** | when_to_use: Processing unpaid leave salary deductions | steps: Determine leave policy (calendar or working days) → Calculate total working days → Subtract public holidays → Divide total salary by actual working days → Generate payroll deduction | [Articles: 14154746403601]\n- **Daily Wage Calculation** | when_to_use: For prorating salaries, calculating leave encashment, and determining unpaid leave deductions | steps: Navigate to Settings → Select Payroll → Choose Daily Wage Calculation → Select calculation type (calendar/working/custom days) → Choose salary components to include → Apply calculation | [Articles: 14243704039185]\n- **Update Salary Proration** | when_to_use: Adjusting salary calculations for partial work periods | steps: Go to Settings > Payroll > Daily wage calculation → Select calculation basis (custom days, calendar days, working days) → Save changes → If payroll month is open, reject existing prorated salary transactions → Confirm new proration settings | [Articles: 14243760419089]\n\n## Rules / Limitations / Constraints\n- Daily pay = Salary Amount (Basic + Allowance) / Number of actual working days [Articles: 14154746403601]\n- Can use calendar days (30 days) or working days (e.g., 22 days) [Articles: 14154746403601]\n- Public holidays are subtracted from working days [Articles: 14154746403601]\n- Calculation can be based on calendar days, working days, or custom days [Articles: 14243704039185]\n- Can exclude weekends and public holidays [Articles: 14243704039185]\n- Most UAE and KSA companies use 30 custom days to align with labor law [Articles: 14243704039185]\n- Changes affect all active (unpaid) amounts in the payroll table [Articles: 14243760419089]\n- When payroll month is open, must reject existing prorated salary transactions before saving new settings [Articles: 14243760419089]\n\n## Edge Cases & Warnings\n- Public holidays must be considered and subtracted from working days [Articles: 14154746403601]\n- Calculation varies depending on month length (e.g., 31 days in January, 28 days in February) [Articles: 14243704039185]\n- When payroll month is open and prorated salary transactions exist, super admin must manually reject and resave transactions [Articles: 14243760419089]\n\n## Feature Interactions / Dependencies\n- Interacts with payroll system to create and reflect pay deductions [Articles: 14154746403601]\n- Interacts with Payroll system and affects active payroll table transactions [Articles: 14243760419089]\n\n## Glossary Terms\n- Daily Pay: Salary Amount (Basic + Allowance) divided by the number of actual working days in a month [Articles: 14154746403601]\n- Calendar days: The number of days in a given month [Articles: 14243704039185]\n- Working days: Only business days are counted, excluding weekends and public holidays [Articles: 14243704039185]\n- Custom days: Flexibility to set calculation base according to company policies [Articles: 14243704039185]\n- Salary Proration: Proportional salary adjustment based on actual days worked, affecting first salary and end-of-service settlement [Articles: 14243760419089]\n\n## Claims To Validate\n- (calculation_rule) | Daily pay is calculated by dividing total salary by the number of actual working days | hint: Verify calculation matches documented formula | risk: low | [Articles: 14154746403601]\n- (system_behavior) | Public holidays are automatically subtracted from total working days | hint: Check if holiday days are correctly removed from working days calculation | risk: low | [Articles: 14154746403601]\n- (navigation) | Daily Wage Calculator is accessible via Settings → Payroll → Daily Wage Calculation | hint: Verify navigation path exists and leads to correct page | risk: low | [Articles: 14243704039185]\n- (system_behavior) | User can select calculation base from calendar days, working days, or custom days | hint: Verify all three calculation base options are available and selectable | risk: low | [Articles: 14243704039185]\n- (calculation_rule) | Salary components can be selected from basic salary, basic salary plus allowances, or allowances only | hint: Verify all three salary component options are present in dropdown/selection | risk: low | [Articles: 14243704039185]\n- (navigation) | Super admin can navigate to Daily wage calculation via Settings > Payroll | hint: Verify menu path exists and is accessible | risk: low | [Articles: 14243760419089]\n- (ui_step) | User can select from custom days, calendar days, or working days calculation basis | hint: Verify all three calculation basis options are present and selectable | risk: low | [Articles: 14243760419089]\n- (system_behavior) | Saving proration changes affects all active (unpaid) payroll amounts | hint: Confirm that saved changes propagate to unpaid transactions | risk: medium | [Articles: 14243760419089]\n\n## Source Articles Index\n- **14154746403601** — How is daily pay calculated (category: feature_documentation) (https://bayzathelp.zendesk.com/hc/en-gb/articles/14154746403601-How-is-daily-pay-calculated)\n- **14243704039185** — Introduction to daily wage calculator (category: feature_introduction) (https://bayzathelp.zendesk.com/hc/en-gb/articles/14243704039185-Introduction-to-daily-wage-calculator)\n- **14243760419089** — Salary Proration (category: feature_documentation) (https://bayzathelp.zendesk.com/hc/en-gb/articles/14243760419089-Salary-Proration)\n"
}