{
  "schema_version": "zendesk_feature_report_v1",
  "meta": {
    "source": "zendesk",
    "generated_at": "2025-12-23",
    "feature_name": "Daily Wage Calculator",
    "feature_slug": "daily_wage_calculator",
    "clean_feature_name": "daily_wage_calculator",
    "articles_received_count": 3,
    "article_ids": [
      "14154746403601",
      "14243704039185",
      "14243760419089"
    ],
    "doc_categories": {
      "feature_documentation": 2,
      "feature_introduction": 1
    },
    "recency_assessment": "fresh",
    "parse_status": "ok"
  },
  "feature": {
    "name": "Daily Wage Calculator",
    "slug": "daily_wage_calculator",
    "description": "The Daily Wage Calculator is a payroll system feature designed to precisely calculate salary deductions for employees taking unpaid leave. It provides a systematic approach to determining daily pay by dividing an employee's total salary by the number of actual working days in a month. The calculator accommodates different leave policies, allowing organizations to choose between calendar days (30 days) or working days (e.g., 22 days) for calculations. A key sophistication of this tool is its ability to automatically account for public holidays, which are subtracted from the total working days to ensure accurate salary reduction. This feature streamlines the complex process of managing unpaid leave by automating pay deductions, reducing manual calculation errors, and providing a transparent method for adjusting employee compensation based on time away from work. The Daily Wage Calculator is an advanced payroll tool designed to provide organizations with flexible and precise methods for calculating employee compensation across various scenarios. It enables payroll managers to dynamically compute daily wage rates using multiple calculation bases including calendar days, working days, or custom days. The system allows granular control over salary component selection, supporting calculations for salary proration, leave encashment, and unpaid leave deductions. By accommodating different regional labor law requirements, such as the 30-day month standard in UAE and KSA, the calculator offers configurable options that align with diverse organizational payroll policies. Users can customize calculations by excluding weekends and public holidays, selecting specific salary components like basic salary or allowances, and tailoring the computational approach to their specific business needs. This flexibility helps organizations achieve more accurate and compliant wage calculations while reducing manual computational errors. The Daily Wage Calculator is a payroll management feature that enables super administrators to precisely prorate employee salaries based on actual days worked. This sophisticated tool allows organizations to calculate compensation proportionally by selecting from multiple calculation bases including custom days, calendar days, or working days. By providing flexible salary calculation methods, the feature ensures accurate compensation for employees during their first month of employment or final service settlement. The system allows administrators to make granular adjustments to salary calculations, which automatically update active (unpaid) amounts in the payroll table. This functionality is critical for maintaining payroll accuracy, especially during partial employment periods or when standard monthly salary calculations are insufficient. The tool provides administrators with the ability to reject and resave prorated salary transactions when necessary, offering comprehensive control over compensation calculations."
  },
  "reference_article_ids": [
    "14154746403601",
    "14243704039185",
    "14243760419089"
  ],
  "source_articles_index": [
    {
      "article_id": 14154746403601,
      "title": "How is daily pay calculated",
      "article_url": "https://bayzathelp.zendesk.com/hc/en-gb/articles/14154746403601-How-is-daily-pay-calculated",
      "doc_category": "feature_documentation",
      "keywords": [
        "unpaid leave",
        "daily pay calculation",
        "salary deduction",
        "working days",
        "calendar days",
        "public holidays",
        "payroll"
      ],
      "article_summary": "Explains the method for calculating daily pay during unpaid leave, including how to handle working days, calendar days, and public holidays"
    },
    {
      "article_id": 14243704039185,
      "title": "Introduction to daily wage calculator",
      "article_url": "https://bayzathelp.zendesk.com/hc/en-gb/articles/14243704039185-Introduction-to-daily-wage-calculator",
      "doc_category": "feature_introduction",
      "keywords": [
        "daily wage",
        "salary proration",
        "leave encashment",
        "unpaid leave",
        "calculation base",
        "calendar days",
        "working days",
        "custom days",
        "payroll",
        "labor law"
      ],
      "article_summary": "Comprehensive overview of the Daily Wage Calculator, explaining its functionality, calculation bases, and application in payroll processing."
    },
    {
      "article_id": 14243760419089,
      "title": "Salary Proration",
      "article_url": "https://bayzathelp.zendesk.com/hc/en-gb/articles/14243760419089-Salary-Proration",
      "doc_category": "feature_documentation",
      "keywords": [
        "daily wage calculator",
        "payroll",
        "salary calculation",
        "prorated salary",
        "super admin",
        "calculation bases",
        "working days",
        "calendar days",
        "custom days"
      ],
      "article_summary": "Explains how to update salary proration for employees, detailing the process of adjusting salary calculations using the Daily Wage Calculator with various calculation bases."
    }
  ],
  "documented_knowledge": {
    "job_to_be_done": [
      {
        "statement": "Calculate and deduct daily pay for employees taking unpaid leave by determining the appropriate salary reduction based on the number of working or calendar days",
        "source_article_ids": [
          14154746403601
        ]
      },
      {
        "statement": "Provide a flexible and customizable method for calculating daily wages, including salary proration, leave encashment, and unpaid leave deductions",
        "source_article_ids": [
          14243704039185
        ]
      },
      {
        "statement": "Adjust and calculate an employee's salary proportionally based on the actual days worked",
        "source_article_ids": [
          14243760419089
        ]
      }
    ],
    "primary_personas": [
      {
        "persona": "HR personnel and payroll administrators responsible for managing employee leave and salary calculations",
        "source_article_ids": [
          14154746403601
        ]
      },
      {
        "persona": "Superadmin",
        "source_article_ids": [
          14243704039185
        ]
      },
      {
        "persona": "Payroll table managers",
        "source_article_ids": [
          14243704039185
        ]
      },
      {
        "persona": "Transaction processors",
        "source_article_ids": [
          14243704039185
        ]
      },
      {
        "persona": "Super admin",
        "source_article_ids": [
          14243760419089
        ]
      }
    ],
    "navigation_paths": [
      {
        "path": "Unpaid Leave Request > Approval > Payroll Deduction Calculation",
        "context": "Process for managing unpaid leave and associated salary adjustments",
        "source_article_ids": [
          14154746403601
        ]
      },
      {
        "path": "Settings → Payroll → Daily Wage Calculation",
        "context": "Accessing the Daily Wage Calculator",
        "source_article_ids": [
          14243704039185
        ]
      },
      {
        "path": "Settings > Payroll > Daily wage calculation",
        "context": "Accessing salary proration configuration",
        "source_article_ids": [
          14243760419089
        ]
      }
    ],
    "prerequisites": [
      {
        "requirement": "Approved unpaid leave request",
        "source_article_ids": [
          14154746403601
        ]
      },
      {
        "requirement": "Access to payroll settings",
        "source_article_ids": [
          14243704039185
        ]
      },
      {
        "requirement": "Company's public holiday calendar configured",
        "source_article_ids": [
          14243704039185
        ]
      },
      {
        "requirement": "Super admin access",
        "source_article_ids": [
          14243760419089
        ]
      }
    ],
    "data_inputs_required": [
      {
        "input": "Employee's total salary (basic + allowance)",
        "details": "Full monthly salary including basic pay and allowances",
        "source_article_ids": [
          14154746403601
        ]
      },
      {
        "input": "Number of working days in the month",
        "details": "Can be calendar days (30) or working days (e.g., 22)",
        "source_article_ids": [
          14154746403601
        ]
      },
      {
        "input": "Calculation base",
        "details": "Calendar days, working days, or custom days",
        "source_article_ids": [
          14243704039185
        ]
      },
      {
        "input": "Salary components",
        "details": "Basic salary, basic salary plus allowances, or allowances only",
        "source_article_ids": [
          14243704039185
        ]
      },
      {
        "input": "Calculation basis",
        "details": "Choose from custom days, calendar days, or working days",
        "source_article_ids": [
          14243760419089
        ]
      }
    ],
    "outputs_results": [
      {
        "output": "Automatic pay deduction",
        "details": "Reflected on the payroll table, calculated daily pay rate for unpaid leave",
        "source_article_ids": [
          14154746403601
        ]
      },
      {
        "output": "Calculated daily wage rates",
        "details": "For salary proration, leave encashment, and unpaid leave deduction",
        "source_article_ids": [
          14243704039185
        ]
      },
      {
        "output": "Prorated salary calculations",
        "details": "Proportionally adjusted employee compensation based on selected calculation method",
        "source_article_ids": [
          14243760419089
        ]
      }
    ],
    "procedures": [
      {
        "procedure_name": "Daily Pay Calculation",
        "when_to_use": "For calculating salary deductions during unpaid leave",
        "steps": [
          "Determine leave policy (calendar or working days)",
          "Calculate total working days",
          "Subtract public holidays",
          "Divide total salary by actual working days",
          "Generate payroll deduction"
        ],
        "source_article_ids": [
          14154746403601
        ]
      },
      {
        "procedure_name": "Daily Wage Calculation",
        "when_to_use": "For prorating salaries, calculating leave encashment, and deducting unpaid leave",
        "steps": [
          "Navigate to Settings",
          "Select Payroll",
          "Choose Daily Wage Calculation",
          "Select calculation base (calendar/working/custom days)",
          "Choose salary components to include",
          "Apply calculation"
        ],
        "source_article_ids": [
          14243704039185
        ]
      },
      {
        "procedure_name": "Update Salary Proration",
        "when_to_use": "Adjusting employee salary calculations",
        "steps": [
          "Go to Settings > Payroll > Daily wage calculation",
          "Select calculation basis (custom days, calendar days, or working days)",
          "Save changes",
          "If payroll month is open, reject existing prorated salary transactions",
          "Resave new proration settings"
        ],
        "source_article_ids": [
          14243760419089
        ]
      }
    ],
    "rules_limitations_constraints": [
      {
        "rule": "Daily pay = Salary Amount (Basic + Allowance) / Number of actual working days",
        "source_article_ids": [
          14154746403601
        ]
      },
      {
        "rule": "Can use either calendar days (30 days) or working days (e.g., 22 days) for calculation",
        "source_article_ids": [
          14154746403601
        ]
      },
      {
        "rule": "Calculation can be based on calendar days, working days, or custom days",
        "source_article_ids": [
          14243704039185
        ]
      },
      {
        "rule": "Can exclude weekends and public holidays",
        "source_article_ids": [
          14243704039185
        ]
      },
      {
        "rule": "Most UAE and KSA companies use 30 custom days to align with labor law",
        "source_article_ids": [
          14243704039185
        ]
      },
      {
        "rule": "Changes affect all active (unpaid) amounts in payroll table",
        "source_article_ids": [
          14243760419089
        ]
      },
      {
        "rule": "When payroll month is open, must reject existing prorated salary transactions before saving new settings",
        "source_article_ids": [
          14243760419089
        ]
      }
    ],
    "edge_cases_warnings": [
      {
        "edge_case_or_warning": "Public holidays must be considered and subtracted from working days",
        "source_article_ids": [
          14154746403601
        ]
      },
      {
        "edge_case_or_warning": "Calculation varies depending on month length (e.g., 31 days in January, 28 days in February)",
        "source_article_ids": [
          14243704039185
        ]
      },
      {
        "edge_case_or_warning": "Manual transaction rejection required when payroll month is open and prorated salary transactions exist",
        "source_article_ids": [
          14243760419089
        ]
      }
    ],
    "feature_interactions_dependencies": [
      {
        "interaction": "Interacts with payroll system to automatically create and reflect pay deductions",
        "source_article_ids": [
          14154746403601
        ]
      },
      {
        "interaction": "Interacts with Payroll settings, public holiday calendar, and leave management systems",
        "source_article_ids": [
          14243704039185
        ]
      },
      {
        "interaction": "Interacts with Payroll system and Daily Wage Calculator (DWC)",
        "source_article_ids": [
          14243760419089
        ]
      }
    ],
    "glossary_terms": [
      {
        "term": "Daily Pay",
        "definition_from_docs": "Calculated by dividing total monthly salary by the number of actual working days",
        "source_article_ids": [
          14154746403601
        ]
      },
      {
        "term": "Salary Proration",
        "definition_from_docs": "Calculating a proportional salary based on days worked",
        "source_article_ids": [
          14243704039185
        ]
      },
      {
        "term": "Leave Encashment",
        "definition_from_docs": "Converting unused leave into monetary compensation",
        "source_article_ids": [
          14243704039185
        ]
      }
    ]
  },
  "claims_to_validate": [
    {
      "claim_id": "daily_pay_calculation_method",
      "claim_type": "calculation_rule",
      "claim_text": "Daily pay is calculated by dividing total salary by the number of actual working days, subtracting public holidays",
      "validation_hint": "Verify calculation matches documented method",
      "source_article_ids": [
        14154746403601
      ],
      "risk_of_being_outdated": "low"
    },
    {
      "claim_id": "leave_policy_flexibility",
      "claim_type": "system_behavior",
      "claim_text": "System supports both calendar days (30 days) and working days (e.g., 22 days) leave policies",
      "validation_hint": "Test switching between calendar and working day calculations",
      "source_article_ids": [
        14154746403601
      ],
      "risk_of_being_outdated": "low"
    },
    {
      "claim_id": "DWC_001",
      "claim_type": "navigation",
      "claim_text": "Daily Wage Calculator can be accessed via Settings → Payroll → Daily Wage Calculation",
      "validation_hint": "Verify navigation path exists and leads to correct interface",
      "source_article_ids": [
        14243704039185
      ],
      "risk_of_being_outdated": "low"
    },
    {
      "claim_id": "DWC_002",
      "claim_type": "system_behavior",
      "claim_text": "Calculator supports three calculation bases: calendar days, working days, and custom days",
      "validation_hint": "Confirm all three calculation base options are available and functional",
      "source_article_ids": [
        14243704039185
      ],
      "risk_of_being_outdated": "low"
    },
    {
      "claim_id": "navigation_path_1",
      "claim_type": "navigation",
      "claim_text": "Super admin can navigate to Settings > Payroll > Daily wage calculation",
      "validation_hint": "Verify UI path exists and is accessible",
      "source_article_ids": [
        14243760419089
      ],
      "risk_of_being_outdated": "low"
    },
    {
      "claim_id": "calculation_basis_selection",
      "claim_type": "ui_step",
      "claim_text": "User can select from custom days, calendar days, or working days calculation basis",
      "validation_hint": "Confirm all three calculation basis options are present",
      "source_article_ids": [
        14243760419089
      ],
      "risk_of_being_outdated": "low"
    },
    {
      "claim_id": "proration_save_behavior",
      "claim_type": "system_behavior",
      "claim_text": "Saving proration changes updates all active (unpaid) amounts in payroll table",
      "validation_hint": "Verify payroll table updates after saving proration settings",
      "source_article_ids": [
        14243760419089
      ],
      "risk_of_being_outdated": "medium"
    }
  ],
  "markdown_report": "# Zendesk Documentation – Daily Wage Calculator\n\nGenerated on: 2025-12-23\n\n## Feature Overview (From Zendesk articles)\nThe Daily Wage Calculator is a payroll system feature designed to precisely calculate salary deductions for employees taking unpaid leave. It provides a systematic approach to determining daily pay by dividing an employee's total salary by the number of actual working days in a month. The calculator accommodates different leave policies, allowing organizations to choose between calendar days (30 days) or working days (e.g., 22 days) for calculations. A key sophistication of this tool is its ability to automatically account for public holidays, which are subtracted from the total working days to ensure accurate salary reduction. This feature streamlines the complex process of managing unpaid leave by automating pay deductions, reducing manual calculation errors, and providing a transparent method for adjusting employee compensation based on time away from work. The Daily Wage Calculator is an advanced payroll tool designed to provide organizations with flexible and precise methods for calculating employee compensation across various scenarios. It enables payroll managers to dynamically compute daily wage rates using multiple calculation bases including calendar days, working days, or custom days. The system allows granular control over salary component selection, supporting calculations for salary proration, leave encashment, and unpaid leave deductions. By accommodating different regional labor law requirements, such as the 30-day month standard in UAE and KSA, the calculator offers configurable options that align with diverse organizational payroll policies. Users can customize calculations by excluding weekends and public holidays, selecting specific salary components like basic salary or allowances, and tailoring the computational approach to their specific business needs. This flexibility helps organizations achieve more accurate and compliant wage calculations while reducing manual computational errors. The Daily Wage Calculator is a payroll management feature that enables super administrators to precisely prorate employee salaries based on actual days worked. This sophisticated tool allows organizations to calculate compensation proportionally by selecting from multiple calculation bases including custom days, calendar days, or working days. By providing flexible salary calculation methods, the feature ensures accurate compensation for employees during their first month of employment or final service settlement. The system allows administrators to make granular adjustments to salary calculations, which automatically update active (unpaid) amounts in the payroll table. This functionality is critical for maintaining payroll accuracy, especially during partial employment periods or when standard monthly salary calculations are insufficient. The tool provides administrators with the ability to reject and resave prorated salary transactions when necessary, offering comprehensive control over compensation calculations.\n\n## Observed Jobs To Be Done\n- Calculate and deduct daily pay for employees taking unpaid leave by determining the appropriate salary reduction based on the number of working or calendar days [Articles: 14154746403601]\n- Provide a flexible and customizable method for calculating daily wages, including salary proration, leave encashment, and unpaid leave deductions [Articles: 14243704039185]\n- Adjust and calculate an employee's salary proportionally based on the actual days worked [Articles: 14243760419089]\n\n## Primary Personas\n- HR personnel and payroll administrators responsible for managing employee leave and salary calculations [Articles: 14154746403601]\n- Superadmin [Articles: 14243704039185]\n- Payroll table managers [Articles: 14243704039185]\n- Transaction processors [Articles: 14243704039185]\n- Super admin [Articles: 14243760419089]\n\n## Navigation Paths\n- Unpaid Leave Request > Approval > Payroll Deduction Calculation | context: Process for managing unpaid leave and associated salary adjustments | [Articles: 14154746403601]\n- Settings → Payroll → Daily Wage Calculation | context: Accessing the Daily Wage Calculator | [Articles: 14243704039185]\n- Settings > Payroll > Daily wage calculation | context: Accessing salary proration configuration | [Articles: 14243760419089]\n\n## Prerequisites\n- Approved unpaid leave request [Articles: 14154746403601]\n- Access to payroll settings [Articles: 14243704039185]\n- Company's public holiday calendar configured [Articles: 14243704039185]\n- Super admin access [Articles: 14243760419089]\n\n## Required Inputs\n- Employee's total salary (basic + allowance) | details: Full monthly salary including basic pay and allowances | [Articles: 14154746403601]\n- Number of working days in the month | details: Can be calendar days (30) or working days (e.g., 22) | [Articles: 14154746403601]\n- Calculation base | details: Calendar days, working days, or custom days | [Articles: 14243704039185]\n- Salary components | details: Basic salary, basic salary plus allowances, or allowances only | [Articles: 14243704039185]\n- Calculation basis | details: Choose from custom days, calendar days, or working days | [Articles: 14243760419089]\n\n## Expected Outputs\n- Automatic pay deduction | details: Reflected on the payroll table, calculated daily pay rate for unpaid leave | [Articles: 14154746403601]\n- Calculated daily wage rates | details: For salary proration, leave encashment, and unpaid leave deduction | [Articles: 14243704039185]\n- Prorated salary calculations | details: Proportionally adjusted employee compensation based on selected calculation method | [Articles: 14243760419089]\n\n## Procedures\n- **Daily Pay Calculation** | when_to_use: For calculating salary deductions during unpaid leave | steps: Determine leave policy (calendar or working days) → Calculate total working days → Subtract public holidays → Divide total salary by actual working days → Generate payroll deduction | [Articles: 14154746403601]\n- **Daily Wage Calculation** | when_to_use: For prorating salaries, calculating leave encashment, and deducting unpaid leave | steps: Navigate to Settings → Select Payroll → Choose Daily Wage Calculation → Select calculation base (calendar/working/custom days) → Choose salary components to include → Apply calculation | [Articles: 14243704039185]\n- **Update Salary Proration** | when_to_use: Adjusting employee salary calculations | steps: Go to Settings > Payroll > Daily wage calculation → Select calculation basis (custom days, calendar days, or working days) → Save changes → If payroll month is open, reject existing prorated salary transactions → Resave new proration settings | [Articles: 14243760419089]\n\n## Rules / Limitations / Constraints\n- Daily pay = Salary Amount (Basic + Allowance) / Number of actual working days [Articles: 14154746403601]\n- Can use either calendar days (30 days) or working days (e.g., 22 days) for calculation [Articles: 14154746403601]\n- Calculation can be based on calendar days, working days, or custom days [Articles: 14243704039185]\n- Can exclude weekends and public holidays [Articles: 14243704039185]\n- Most UAE and KSA companies use 30 custom days to align with labor law [Articles: 14243704039185]\n- Changes affect all active (unpaid) amounts in payroll table [Articles: 14243760419089]\n- When payroll month is open, must reject existing prorated salary transactions before saving new settings [Articles: 14243760419089]\n\n## Edge Cases & Warnings\n- Public holidays must be considered and subtracted from working days [Articles: 14154746403601]\n- Calculation varies depending on month length (e.g., 31 days in January, 28 days in February) [Articles: 14243704039185]\n- Manual transaction rejection required when payroll month is open and prorated salary transactions exist [Articles: 14243760419089]\n\n## Feature Interactions / Dependencies\n- Interacts with payroll system to automatically create and reflect pay deductions [Articles: 14154746403601]\n- Interacts with Payroll settings, public holiday calendar, and leave management systems [Articles: 14243704039185]\n- Interacts with Payroll system and Daily Wage Calculator (DWC) [Articles: 14243760419089]\n\n## Glossary Terms\n- Daily Pay: Calculated by dividing total monthly salary by the number of actual working days [Articles: 14154746403601]\n- Salary Proration: Calculating a proportional salary based on days worked [Articles: 14243704039185]\n- Leave Encashment: Converting unused leave into monetary compensation [Articles: 14243704039185]\n\n## Claims To Validate\n- (calculation_rule) | Daily pay is calculated by dividing total salary by the number of actual working days, subtracting public holidays | hint: Verify calculation matches documented method | risk: low | [Articles: 14154746403601]\n- (system_behavior) | System supports both calendar days (30 days) and working days (e.g., 22 days) leave policies | hint: Test switching between calendar and working day calculations | risk: low | [Articles: 14154746403601]\n- (navigation) | Daily Wage Calculator can be accessed via Settings → Payroll → Daily Wage Calculation | hint: Verify navigation path exists and leads to correct interface | risk: low | [Articles: 14243704039185]\n- (system_behavior) | Calculator supports three calculation bases: calendar days, working days, and custom days | hint: Confirm all three calculation base options are available and functional | risk: low | [Articles: 14243704039185]\n- (navigation) | Super admin can navigate to Settings > Payroll > Daily wage calculation | hint: Verify UI path exists and is accessible | risk: low | [Articles: 14243760419089]\n- (ui_step) | User can select from custom days, calendar days, or working days calculation basis | hint: Confirm all three calculation basis options are present | risk: low | [Articles: 14243760419089]\n- (system_behavior) | Saving proration changes updates all active (unpaid) amounts in payroll table | hint: Verify payroll table updates after saving proration settings | risk: medium | [Articles: 14243760419089]\n\n## Source Articles Index\n- **14154746403601** — How is daily pay calculated (category: feature_documentation) (https://bayzathelp.zendesk.com/hc/en-gb/articles/14154746403601-How-is-daily-pay-calculated)\n- **14243704039185** — Introduction to daily wage calculator (category: feature_introduction) (https://bayzathelp.zendesk.com/hc/en-gb/articles/14243704039185-Introduction-to-daily-wage-calculator)\n- **14243760419089** — Salary Proration (category: feature_documentation) (https://bayzathelp.zendesk.com/hc/en-gb/articles/14243760419089-Salary-Proration)\n"
}