{
  "schema_version": "zendesk_feature_report_v1",
  "meta": {
    "source": "zendesk",
    "generated_at": "2025-12-21",
    "feature_name": "daily wage calculator",
    "feature_slug": "daily_wage_calculator",
    "clean_feature_name": "daily_wage_calculator",
    "articles_received_count": 3,
    "article_ids": [
      "14154746403601",
      "14243704039185",
      "14243760419089"
    ],
    "doc_categories": {
      "feature_documentation": 2,
      "feature_introduction": 1
    },
    "recency_assessment": "fresh",
    "parse_status": "ok"
  },
  "feature": {
    "name": "daily wage calculator",
    "slug": "daily_wage_calculator",
    "description": "The daily wage calculator is a payroll management tool designed to precisely calculate salary deductions for employees taking unpaid leave. It provides a systematic method for determining daily pay by dividing an employee's total salary (basic + allowance) by the number of actual working days in a month. The calculator accommodates different leave policies, allowing organizations to use either calendar days (30 days) or working days (e.g., 22 days) as the basis for calculations. A critical feature of this tool is its ability to automatically account for public holidays, which are subtracted from the total working days to ensure accurate pay deductions. By integrating with payroll systems, the calculator generates automatic deductions that are directly reflected in the payroll table, streamlining the complex process of managing unpaid leave and salary adjustments. This feature helps HR personnel and payroll administrators maintain precise financial records and ensures fair, consistent treatment of employee leave and compensation. The daily wage calculator is an advanced payroll tool designed to provide organizations with flexible and precise methods for calculating employee compensation. It addresses previous limitations in wage calculation by offering multiple calculation bases including calendar days, working days, and custom days. The tool enables payroll managers to customize wage calculations by selecting specific salary components such as basic salary, basic salary plus allowances, or allowances only. By supporting different calculation methods, the system supports critical payroll processes like salary proration, leave encashment, and unpaid leave deductions. The calculator accommodates regional labor law requirements, particularly for companies in UAE and KSA that typically use 30-day calculation methods. Its flexibility allows organizations to align wage calculations with their specific company policies and legal frameworks. The tool provides granular control over wage computation, reducing manual calculation errors and standardizing payroll processes across different employee categories. The daily wage calculator is a payroll management tool designed to proportionally adjust employee compensation based on actual days worked. It enables super administrators to precisely calculate salaries by selecting different calculation bases such as custom days, calendar days, or working days. This feature is critical for handling prorated salaries during an employee's first month of work or final settlement, ensuring accurate and fair compensation. By providing flexible calculation methods, organizations can adapt salary calculations to their specific business rules and employment scenarios. The tool integrates directly with the payroll system, allowing administrators to make real-time adjustments that immediately impact active payroll transactions. It supports complex payroll scenarios by offering multiple calculation approaches, reducing manual computation errors and streamlining compensation management. The calculator helps maintain transparency in salary processing and provides a systematic approach to handling partial month employment periods."
  },
  "reference_article_ids": [
    "14154746403601",
    "14243704039185",
    "14243760419089"
  ],
  "source_articles_index": [
    {
      "article_id": 14154746403601,
      "title": "How is daily pay calculated",
      "article_url": "https://bayzathelp.zendesk.com/hc/en-gb/articles/14154746403601-How-is-daily-pay-calculated",
      "doc_category": "feature_documentation",
      "keywords": [
        "unpaid leave",
        "daily pay calculation",
        "salary deduction",
        "working days",
        "calendar days",
        "public holidays",
        "payroll"
      ],
      "article_summary": "Explains the process of calculating daily pay for unpaid leave, including how to determine working days, account for public holidays, and generate payroll deductions."
    },
    {
      "article_id": 14243704039185,
      "title": "Introduction to daily wage calculator",
      "article_url": "https://bayzathelp.zendesk.com/hc/en-gb/articles/14243704039185-Introduction-to-daily-wage-calculator",
      "doc_category": "feature_introduction",
      "keywords": [
        "daily wage",
        "salary proration",
        "leave encashment",
        "unpaid leave",
        "calculation base",
        "calendar days",
        "working days",
        "custom days",
        "payroll",
        "labor law"
      ],
      "article_summary": "Introduces a new Daily Wage calculator with flexible calculation options for salary proration, leave encashment, and unpaid leave deductions."
    },
    {
      "article_id": 14243760419089,
      "title": "Salary Proration",
      "article_url": "https://bayzathelp.zendesk.com/hc/en-gb/articles/14243760419089-Salary-Proration",
      "doc_category": "feature_documentation",
      "keywords": [
        "daily wage calculator",
        "payroll",
        "salary calculation",
        "prorated salary",
        "super admin",
        "calculation bases",
        "working days",
        "calendar days",
        "custom days"
      ],
      "article_summary": "Explains how to update salary proration using the Daily Wage Calculator, including steps to change calculation bases and handle prorated salary transactions."
    }
  ],
  "documented_knowledge": {
    "job_to_be_done": [
      {
        "statement": "Calculate and deduct daily pay for employees taking unpaid leave by determining the appropriate salary reduction based on the number of working or calendar days",
        "source_article_ids": [
          14154746403601
        ]
      },
      {
        "statement": "Provide a flexible and customizable method for calculating daily wages, including salary proration, leave encashment, and unpaid leave deductions",
        "source_article_ids": [
          14243704039185
        ]
      },
      {
        "statement": "Adjust and calculate an employee's salary proportionally based on the actual days worked",
        "source_article_ids": [
          14243760419089
        ]
      }
    ],
    "primary_personas": [
      {
        "persona": "HR personnel and payroll administrators responsible for managing employee leave and salary calculations",
        "source_article_ids": [
          14154746403601
        ]
      },
      {
        "persona": "Superadmin",
        "source_article_ids": [
          14243704039185
        ]
      },
      {
        "persona": "Payroll table managers",
        "source_article_ids": [
          14243704039185
        ]
      },
      {
        "persona": "Transaction processors",
        "source_article_ids": [
          14243704039185
        ]
      },
      {
        "persona": "Super admin",
        "source_article_ids": [
          14243760419089
        ]
      }
    ],
    "navigation_paths": [
      {
        "path": "Unpaid Leave Request > Approval > Pay Calculation",
        "context": "Process for managing unpaid leave and corresponding salary deductions",
        "source_article_ids": [
          14154746403601
        ]
      },
      {
        "path": "Settings → Payroll → Daily Wage Calculation",
        "context": "Accessing the daily wage calculator",
        "source_article_ids": [
          14243704039185
        ]
      },
      {
        "path": "Settings > Payroll > Daily wage calculation",
        "context": "Accessing salary proration configuration",
        "source_article_ids": [
          14243760419089
        ]
      }
    ],
    "prerequisites": [
      {
        "requirement": "Approved unpaid leave request",
        "source_article_ids": [
          14154746403601
        ]
      },
      {
        "requirement": "Access to payroll settings",
        "source_article_ids": [
          14243704039185
        ]
      },
      {
        "requirement": "Company's public holiday calendar configured",
        "source_article_ids": [
          14243704039185
        ]
      },
      {
        "requirement": "Super admin access to payroll settings",
        "source_article_ids": [
          14243760419089
        ]
      }
    ],
    "data_inputs_required": [
      {
        "input": "Employee's total salary (basic + allowance)",
        "details": "Full monthly salary to be used for daily rate calculation",
        "source_article_ids": [
          14154746403601
        ]
      },
      {
        "input": "Number of working days in the month",
        "details": "Can be calendar days (30) or working days (e.g., 22)",
        "source_article_ids": [
          14154746403601
        ]
      },
      {
        "input": "Calculation base",
        "details": "Calendar days, working days, or custom days",
        "source_article_ids": [
          14243704039185
        ]
      },
      {
        "input": "Salary components",
        "details": "Basic salary, basic salary plus allowances, or allowances only",
        "source_article_ids": [
          14243704039185
        ]
      },
      {
        "input": "Calculation basis",
        "details": "Choose from custom days, calendar days, or working days",
        "source_article_ids": [
          14243760419089
        ]
      }
    ],
    "outputs_results": [
      {
        "output": "Automatic pay deduction",
        "details": "Reflected on the payroll table, calculated daily pay rate for unpaid leave",
        "source_article_ids": [
          14154746403601
        ]
      },
      {
        "output": "Daily wage rates",
        "details": "Calculated for salary proration, leave encashment, and unpaid leave deduction",
        "source_article_ids": [
          14243704039185
        ]
      },
      {
        "output": "Prorated salary calculation",
        "details": "Proportionally adjusted employee compensation",
        "source_article_ids": [
          14243760419089
        ]
      }
    ],
    "procedures": [
      {
        "procedure_name": "Daily Pay Calculation",
        "when_to_use": "When processing unpaid leave salary deductions",
        "steps": [
          "Receive and approve unpaid leave request",
          "Determine leave policy (calendar or working days)",
          "Calculate total working days",
          "Subtract public holidays",
          "Calculate daily pay rate: Salary / Actual Working Days",
          "Generate payroll deduction"
        ],
        "source_article_ids": [
          14154746403601
        ]
      },
      {
        "procedure_name": "Daily Wage Calculation",
        "when_to_use": "For prorating salaries, calculating leave encashment, and determining unpaid leave deductions",
        "steps": [
          "Access Daily Wage Calculator from Settings → Payroll → Daily Wage Calculation",
          "Select calculation base (calendar days, working days, or custom days)",
          "Choose salary components to factor into calculations"
        ],
        "source_article_ids": [
          14243704039185
        ]
      },
      {
        "procedure_name": "Update Salary Proration",
        "when_to_use": "Adjusting salary calculations for partial work periods",
        "steps": [
          "Go to Settings > Payroll > Daily wage calculation",
          "Select calculation basis (custom days, calendar days, working days)",
          "Save changes",
          "If payroll month is open, reject existing prorated transactions",
          "Confirm new proration settings"
        ],
        "source_article_ids": [
          14243760419089
        ]
      }
    ],
    "rules_limitations_constraints": [
      {
        "rule": "Daily pay calculated by dividing total salary by number of actual working days",
        "source_article_ids": [
          14154746403601
        ]
      },
      {
        "rule": "Can use calendar days (30 days) or working days (e.g., 22 days)",
        "source_article_ids": [
          14154746403601
        ]
      },
      {
        "rule": "Public holidays must be deducted from working days",
        "source_article_ids": [
          14154746403601
        ]
      },
      {
        "rule": "Calculation can be based on calendar days, working days, or custom days",
        "source_article_ids": [
          14243704039185
        ]
      },
      {
        "rule": "Can exclude weekends and public holidays",
        "source_article_ids": [
          14243704039185
        ]
      },
      {
        "rule": "Most UAE and KSA companies use 30 custom days to align with labor law",
        "source_article_ids": [
          14243704039185
        ]
      },
      {
        "rule": "Changes affect all active (unpaid) amounts in payroll table",
        "source_article_ids": [
          14243760419089
        ]
      }
    ],
    "edge_cases_warnings": [
      {
        "edge_case_or_warning": "Public holidays must be considered and subtracted from working days when calculating daily pay",
        "source_article_ids": [
          14154746403601
        ]
      },
      {
        "edge_case_or_warning": "Calculation varies depending on month length (e.g., 31 days in January, 28 days in February)",
        "source_article_ids": [
          14243704039185
        ]
      },
      {
        "edge_case_or_warning": "When payroll month is open, manually reject and resave prorated salary transactions",
        "source_article_ids": [
          14243760419089
        ]
      }
    ],
    "feature_interactions_dependencies": [
      {
        "interaction": "Interacts with payroll system to automatically create and reflect pay deductions",
        "source_article_ids": [
          14154746403601
        ]
      },
      {
        "interaction": "Interacts with Payroll system and affects active payroll table transactions",
        "source_article_ids": [
          14243760419089
        ]
      }
    ],
    "glossary_terms": [
      {
        "term": "Daily Pay",
        "definition_from_docs": "Salary Amount (Basic + Allowance) / Number of Actual Working Days",
        "source_article_ids": [
          14154746403601
        ]
      },
      {
        "term": "Calendar days",
        "definition_from_docs": "The number of days in a given month (e.g., 31 in January, 28 in February)",
        "source_article_ids": [
          14243704039185
        ]
      },
      {
        "term": "Working days",
        "definition_from_docs": "Only business days counted, excluding weekends and public holidays",
        "source_article_ids": [
          14243704039185
        ]
      },
      {
        "term": "Custom days",
        "definition_from_docs": "Flexible calculation base allowing configuration according to company policies",
        "source_article_ids": [
          14243704039185
        ]
      },
      {
        "term": "Salary Proration",
        "definition_from_docs": "Proportional salary adjustment based on actual days worked",
        "source_article_ids": [
          14243760419089
        ]
      }
    ]
  },
  "claims_to_validate": [
    {
      "claim_id": "daily_pay_calculation_1",
      "claim_type": "calculation_rule",
      "claim_text": "Daily pay is calculated by dividing total monthly salary by the number of actual working days",
      "validation_hint": "Verify calculation matches: Total Salary / (Working Days - Public Holidays)",
      "source_article_ids": [
        14154746403601
      ],
      "risk_of_being_outdated": "low"
    },
    {
      "claim_id": "daily_pay_calculation_2",
      "claim_type": "system_behavior",
      "claim_text": "Public holidays are automatically subtracted from total working days",
      "validation_hint": "Check that system reduces working days count when public holidays are present",
      "source_article_ids": [
        14154746403601
      ],
      "risk_of_being_outdated": "low"
    },
    {
      "claim_id": "navigation_path_1",
      "claim_type": "navigation",
      "claim_text": "Daily Wage Calculator can be accessed via Settings → Payroll → Daily Wage Calculation",
      "validation_hint": "Verify user can navigate to Daily Wage Calculation screen",
      "source_article_ids": [
        14243704039185
      ],
      "risk_of_being_outdated": "low"
    },
    {
      "claim_id": "calculation_base_selection",
      "claim_type": "system_behavior",
      "claim_text": "User can select between calendar days, working days, and custom days for wage calculation",
      "validation_hint": "Verify all three calculation base options are available and selectable",
      "source_article_ids": [
        14243704039185
      ],
      "risk_of_being_outdated": "low"
    },
    {
      "claim_id": "salary_component_selection",
      "claim_type": "system_behavior",
      "claim_text": "User can choose salary components: basic salary, basic salary plus allowances, or allowances only",
      "validation_hint": "Verify all three salary component options are available and selectable",
      "source_article_ids": [
        14243704039185
      ],
      "risk_of_being_outdated": "low"
    },
    {
      "claim_id": "daily_wage_calc_001",
      "claim_type": "navigation",
      "claim_text": "Super admin can navigate to Settings > Payroll > Daily wage calculation",
      "validation_hint": "Verify UI path exists and is accessible",
      "source_article_ids": [
        14243760419089
      ],
      "risk_of_being_outdated": "low"
    },
    {
      "claim_id": "daily_wage_calc_002",
      "claim_type": "ui_step",
      "claim_text": "User can select calculation basis from custom days, calendar days, or working days",
      "validation_hint": "Check dropdown/selection mechanism for calculation bases",
      "source_article_ids": [
        14243760419089
      ],
      "risk_of_being_outdated": "low"
    }
  ],
  "markdown_report": "# Zendesk Documentation – daily wage calculator\n\nGenerated on: 2025-12-21\n\n## Feature Overview (From Zendesk articles)\nThe daily wage calculator is a payroll management tool designed to precisely calculate salary deductions for employees taking unpaid leave. It provides a systematic method for determining daily pay by dividing an employee's total salary (basic + allowance) by the number of actual working days in a month. The calculator accommodates different leave policies, allowing organizations to use either calendar days (30 days) or working days (e.g., 22 days) as the basis for calculations. A critical feature of this tool is its ability to automatically account for public holidays, which are subtracted from the total working days to ensure accurate pay deductions. By integrating with payroll systems, the calculator generates automatic deductions that are directly reflected in the payroll table, streamlining the complex process of managing unpaid leave and salary adjustments. This feature helps HR personnel and payroll administrators maintain precise financial records and ensures fair, consistent treatment of employee leave and compensation. The daily wage calculator is an advanced payroll tool designed to provide organizations with flexible and precise methods for calculating employee compensation. It addresses previous limitations in wage calculation by offering multiple calculation bases including calendar days, working days, and custom days. The tool enables payroll managers to customize wage calculations by selecting specific salary components such as basic salary, basic salary plus allowances, or allowances only. By supporting different calculation methods, the system supports critical payroll processes like salary proration, leave encashment, and unpaid leave deductions. The calculator accommodates regional labor law requirements, particularly for companies in UAE and KSA that typically use 30-day calculation methods. Its flexibility allows organizations to align wage calculations with their specific company policies and legal frameworks. The tool provides granular control over wage computation, reducing manual calculation errors and standardizing payroll processes across different employee categories. The daily wage calculator is a payroll management tool designed to proportionally adjust employee compensation based on actual days worked. It enables super administrators to precisely calculate salaries by selecting different calculation bases such as custom days, calendar days, or working days. This feature is critical for handling prorated salaries during an employee's first month of work or final settlement, ensuring accurate and fair compensation. By providing flexible calculation methods, organizations can adapt salary calculations to their specific business rules and employment scenarios. The tool integrates directly with the payroll system, allowing administrators to make real-time adjustments that immediately impact active payroll transactions. It supports complex payroll scenarios by offering multiple calculation approaches, reducing manual computation errors and streamlining compensation management. The calculator helps maintain transparency in salary processing and provides a systematic approach to handling partial month employment periods.\n\n## Observed Jobs To Be Done\n- Calculate and deduct daily pay for employees taking unpaid leave by determining the appropriate salary reduction based on the number of working or calendar days [Articles: 14154746403601]\n- Provide a flexible and customizable method for calculating daily wages, including salary proration, leave encashment, and unpaid leave deductions [Articles: 14243704039185]\n- Adjust and calculate an employee's salary proportionally based on the actual days worked [Articles: 14243760419089]\n\n## Primary Personas\n- HR personnel and payroll administrators responsible for managing employee leave and salary calculations [Articles: 14154746403601]\n- Superadmin [Articles: 14243704039185]\n- Payroll table managers [Articles: 14243704039185]\n- Transaction processors [Articles: 14243704039185]\n- Super admin [Articles: 14243760419089]\n\n## Navigation Paths\n- Unpaid Leave Request > Approval > Pay Calculation | context: Process for managing unpaid leave and corresponding salary deductions | [Articles: 14154746403601]\n- Settings → Payroll → Daily Wage Calculation | context: Accessing the daily wage calculator | [Articles: 14243704039185]\n- Settings > Payroll > Daily wage calculation | context: Accessing salary proration configuration | [Articles: 14243760419089]\n\n## Prerequisites\n- Approved unpaid leave request [Articles: 14154746403601]\n- Access to payroll settings [Articles: 14243704039185]\n- Company's public holiday calendar configured [Articles: 14243704039185]\n- Super admin access to payroll settings [Articles: 14243760419089]\n\n## Required Inputs\n- Employee's total salary (basic + allowance) | details: Full monthly salary to be used for daily rate calculation | [Articles: 14154746403601]\n- Number of working days in the month | details: Can be calendar days (30) or working days (e.g., 22) | [Articles: 14154746403601]\n- Calculation base | details: Calendar days, working days, or custom days | [Articles: 14243704039185]\n- Salary components | details: Basic salary, basic salary plus allowances, or allowances only | [Articles: 14243704039185]\n- Calculation basis | details: Choose from custom days, calendar days, or working days | [Articles: 14243760419089]\n\n## Expected Outputs\n- Automatic pay deduction | details: Reflected on the payroll table, calculated daily pay rate for unpaid leave | [Articles: 14154746403601]\n- Daily wage rates | details: Calculated for salary proration, leave encashment, and unpaid leave deduction | [Articles: 14243704039185]\n- Prorated salary calculation | details: Proportionally adjusted employee compensation | [Articles: 14243760419089]\n\n## Procedures\n- **Daily Pay Calculation** | when_to_use: When processing unpaid leave salary deductions | steps: Receive and approve unpaid leave request → Determine leave policy (calendar or working days) → Calculate total working days → Subtract public holidays → Calculate daily pay rate: Salary / Actual Working Days → Generate payroll deduction | [Articles: 14154746403601]\n- **Daily Wage Calculation** | when_to_use: For prorating salaries, calculating leave encashment, and determining unpaid leave deductions | steps: Access Daily Wage Calculator from Settings → Payroll → Daily Wage Calculation → Select calculation base (calendar days, working days, or custom days) → Choose salary components to factor into calculations | [Articles: 14243704039185]\n- **Update Salary Proration** | when_to_use: Adjusting salary calculations for partial work periods | steps: Go to Settings > Payroll > Daily wage calculation → Select calculation basis (custom days, calendar days, working days) → Save changes → If payroll month is open, reject existing prorated transactions → Confirm new proration settings | [Articles: 14243760419089]\n\n## Rules / Limitations / Constraints\n- Daily pay calculated by dividing total salary by number of actual working days [Articles: 14154746403601]\n- Can use calendar days (30 days) or working days (e.g., 22 days) [Articles: 14154746403601]\n- Public holidays must be deducted from working days [Articles: 14154746403601]\n- Calculation can be based on calendar days, working days, or custom days [Articles: 14243704039185]\n- Can exclude weekends and public holidays [Articles: 14243704039185]\n- Most UAE and KSA companies use 30 custom days to align with labor law [Articles: 14243704039185]\n- Changes affect all active (unpaid) amounts in payroll table [Articles: 14243760419089]\n\n## Edge Cases & Warnings\n- Public holidays must be considered and subtracted from working days when calculating daily pay [Articles: 14154746403601]\n- Calculation varies depending on month length (e.g., 31 days in January, 28 days in February) [Articles: 14243704039185]\n- When payroll month is open, manually reject and resave prorated salary transactions [Articles: 14243760419089]\n\n## Feature Interactions / Dependencies\n- Interacts with payroll system to automatically create and reflect pay deductions [Articles: 14154746403601]\n- Interacts with Payroll system and affects active payroll table transactions [Articles: 14243760419089]\n\n## Glossary Terms\n- Daily Pay: Salary Amount (Basic + Allowance) / Number of Actual Working Days [Articles: 14154746403601]\n- Calendar days: The number of days in a given month (e.g., 31 in January, 28 in February) [Articles: 14243704039185]\n- Working days: Only business days counted, excluding weekends and public holidays [Articles: 14243704039185]\n- Custom days: Flexible calculation base allowing configuration according to company policies [Articles: 14243704039185]\n- Salary Proration: Proportional salary adjustment based on actual days worked [Articles: 14243760419089]\n\n## Claims To Validate\n- (calculation_rule) | Daily pay is calculated by dividing total monthly salary by the number of actual working days | hint: Verify calculation matches: Total Salary / (Working Days - Public Holidays) | risk: low | [Articles: 14154746403601]\n- (system_behavior) | Public holidays are automatically subtracted from total working days | hint: Check that system reduces working days count when public holidays are present | risk: low | [Articles: 14154746403601]\n- (navigation) | Daily Wage Calculator can be accessed via Settings → Payroll → Daily Wage Calculation | hint: Verify user can navigate to Daily Wage Calculation screen | risk: low | [Articles: 14243704039185]\n- (system_behavior) | User can select between calendar days, working days, and custom days for wage calculation | hint: Verify all three calculation base options are available and selectable | risk: low | [Articles: 14243704039185]\n- (system_behavior) | User can choose salary components: basic salary, basic salary plus allowances, or allowances only | hint: Verify all three salary component options are available and selectable | risk: low | [Articles: 14243704039185]\n- (navigation) | Super admin can navigate to Settings > Payroll > Daily wage calculation | hint: Verify UI path exists and is accessible | risk: low | [Articles: 14243760419089]\n- (ui_step) | User can select calculation basis from custom days, calendar days, or working days | hint: Check dropdown/selection mechanism for calculation bases | risk: low | [Articles: 14243760419089]\n\n## Source Articles Index\n- **14154746403601** — How is daily pay calculated (category: feature_documentation) (https://bayzathelp.zendesk.com/hc/en-gb/articles/14154746403601-How-is-daily-pay-calculated)\n- **14243704039185** — Introduction to daily wage calculator (category: feature_introduction) (https://bayzathelp.zendesk.com/hc/en-gb/articles/14243704039185-Introduction-to-daily-wage-calculator)\n- **14243760419089** — Salary Proration (category: feature_documentation) (https://bayzathelp.zendesk.com/hc/en-gb/articles/14243760419089-Salary-Proration)\n"
}