{
  "schema_version": "zendesk_feature_report_v1",
  "meta": {
    "source": "zendesk",
    "generated_at": "2025-12-23",
    "feature_name": "Unknown Feature",
    "feature_slug": "unknown_feature",
    "clean_feature_name": "unknown_feature",
    "articles_received_count": 0,
    "article_ids": [],
    "doc_categories": {},
    "recency_assessment": "unknown",
    "parse_status": "no_valid_ai_outputs"
  },
  "feature": {
    "name": "Unknown Feature",
    "slug": "unknown_feature",
    "description": "Derived from Zendesk Help Center evidence (structured extraction)."
  },
  "reference_article_ids": [],
  "source_articles_index": [],
  "documented_knowledge": {
    "job_to_be_done": [],
    "primary_personas": [],
    "navigation_paths": [],
    "prerequisites": [],
    "data_inputs_required": [],
    "outputs_results": [],
    "procedures": [],
    "rules_limitations_constraints": [],
    "edge_cases_warnings": [],
    "feature_interactions_dependencies": [],
    "glossary_terms": []
  },
  "claims_to_validate": [],
  "markdown_report": "# Zendesk Documentation â€“ Unknown Feature\n\nGenerated on: 2025-12-23\n\n## Feature Overview (From Zendesk articles)\nDerived from Zendesk Help Center evidence (structured extraction).\n\n## Observed Jobs To Be Done\n- (none found in Zendesk evidence)\n\n## Primary Personas\n- (none found in Zendesk evidence)\n\n## Navigation Paths\n- (none found in Zendesk evidence)\n\n## Prerequisites\n- (none found in Zendesk evidence)\n\n## Required Inputs\n- (none found in Zendesk evidence)\n\n## Expected Outputs\n- (none found in Zendesk evidence)\n\n## Procedures\n- (none found in Zendesk evidence)\n\n## Rules / Limitations / Constraints\n- (none found in Zendesk evidence)\n\n## Edge Cases & Warnings\n- (none found in Zendesk evidence)\n\n## Feature Interactions / Dependencies\n- (none found in Zendesk evidence)\n\n## Glossary Terms\n- (none found in Zendesk evidence)\n\n## Claims To Validate\n- (none found in Zendesk evidence)\n\n## Source Articles Index\n- (none found in Zendesk evidence)\n"
}